<?xml version="1.0" encoding="UTF-8"?>
<Library xmlns:xsi="http://www.w3.org/2001/XMLSchema-instance"
         xsi:noNamespaceSchemaLocation="Library.xsd">

  <PublishingCompany>
    <CompanyName>PublishCo1</CompanyName>
    <Books>
      <Book>
        <Title>Introduction to XML</Title>
        <Author>John Doe</Author>
        <PublicationYear>2022</PublicationYear>
        <Genre>Non-Fiction</Genre>
      </Book>

      <Book>
        <Title>Programming in Java</Title>
        <Author>Jane Smith</Author>
        <PublicationYear>2021</PublicationYear>
        <Genre>Fiction</Genre>
      </Book>
    </Books>
  </PublishingCompany>

  <PublishingCompany>
    <CompanyName>PublishCo2</CompanyName>
    <Books>
      <Book>
        <Title>Data Science Essentials</Title>
        <Author>Alice Johnson</Author>
        <PublicationYear>2020</PublicationYear>
        <Genre>Science Fiction</Genre>
      </Book>
    </Books>
  </PublishingCompany>

</Library>
